{
  "verdict": "needs_split",
  "size": {
    "heuristic_loc": 120,
    "skeleton_loc": 169,
    "skeleton_projected_loc": 203,
    "consensus_loc": 203,
    "severity": "MINOR",
    "calibration_drift": false,
    "calibration_delta": 0.409
  },
  "cohesion": {
    "group_count": 3,
    "severity": "SEVERE",
    "groups": [
      {
        "label": "Layered configuration snapshot construction",
        "acs": [
          "US-1.1",
          "US-1.2",
          "US-1.3",
          "US-1.4",
          "US-1.5"
        ],
        "shared_signals": [
          "data_type:config.toml",
          "data_type:configuration settings",
          "lifecycle:construction"
        ]
      },
      {
        "label": "Repository contained target execution",
        "acs": [
          "US-2.1",
          "US-2.2",
          "US-2.3",
          "US-2.4"
        ],
        "shared_signals": [
          "data_type:repository root",
          "data_type:review/search targets",
          "lifecycle:subscribe"
        ]
      },
      {
        "label": "Separate resource storage preservation",
        "acs": [
          "US-2.5"
        ],
        "shared_signals": []
      }
    ]
  },
  "split_recommendation": {
    "should_split": true,
    "driver": "cohesion",
    "candidate_subtasks": [
      {
        "title": "Layered configuration snapshot construction",
        "acs": [
          "US-1.1",
          "US-1.2",
          "US-1.3",
          "US-1.4",
          "US-1.5"
        ],
        "estimated_size_band": "small"
      },
      {
        "title": "Repository contained target execution",
        "acs": [
          "US-2.1",
          "US-2.2",
          "US-2.3",
          "US-2.4"
        ],
        "estimated_size_band": "small"
      },
      {
        "title": "Separate resource storage preservation",
        "acs": [
          "US-2.5"
        ],
        "estimated_size_band": "small"
      }
    ]
  }
}
