{
  "verdict": "needs_split",
  "size": {
    "heuristic_loc": 120,
    "skeleton_loc": 34,
    "skeleton_projected_loc": 41,
    "consensus_loc": 120,
    "severity": "COMPLIANT",
    "calibration_drift": true,
    "calibration_delta": 0.658
  },
  "cohesion": {
    "group_count": 5,
    "severity": "SEVERE",
    "groups": [
      {
        "label": "Retained MCP runtime surface",
        "acs": [
          "US-1.1",
          "US-1.2",
          "US-3.1"
        ],
        "shared_signals": [
          "data_type:MCP tools",
          "data_type:retirement ledger",
          "integration:MCP",
          "lifecycle:subscribe"
        ]
      },
      {
        "label": "Repository host manifest configuration",
        "acs": [
          "US-1.3"
        ],
        "shared_signals": []
      },
      {
        "label": "Retained workflow runtime behavior",
        "acs": [
          "US-1.4",
          "US-3.2"
        ],
        "shared_signals": [
          "integration:Legacy healthcheck",
          "lifecycle:subscribe"
        ]
      },
      {
        "label": "Recoverable instruction discovery inventory",
        "acs": [
          "US-2.1",
          "US-2.2",
          "US-2.3"
        ],
        "shared_signals": [
          "data_type:agent entrypoints",
          "data_type:retirement ledger",
          "data_type:skill entrypoints",
          "lifecycle:observation"
        ]
      },
      {
        "label": "Global installation evidence boundary",
        "acs": [
          "US-3.3"
        ],
        "shared_signals": []
      }
    ]
  },
  "split_recommendation": {
    "should_split": true,
    "driver": "cohesion",
    "candidate_subtasks": [
      {
        "title": "Retained MCP runtime surface",
        "acs": [
          "US-1.1",
          "US-1.2",
          "US-3.1"
        ],
        "estimated_size_band": "tiny"
      },
      {
        "title": "Repository host manifest configuration",
        "acs": [
          "US-1.3"
        ],
        "estimated_size_band": "tiny"
      },
      {
        "title": "Retained workflow runtime behavior",
        "acs": [
          "US-1.4",
          "US-3.2"
        ],
        "estimated_size_band": "tiny"
      },
      {
        "title": "Recoverable instruction discovery inventory",
        "acs": [
          "US-2.1",
          "US-2.2",
          "US-2.3"
        ],
        "estimated_size_band": "tiny"
      },
      {
        "title": "Global installation evidence boundary",
        "acs": [
          "US-3.3"
        ],
        "estimated_size_band": "tiny"
      }
    ]
  }
}
